name	sex	wikipedia_url	jsp_url	birth_date	birth_date_md	death_date	death_date_md	date	date_md	best_date	best_year	best_month	best_day	tagline	tagline_md	office	outcome	for	alt_for	notes	notes_md	unit	unit_md	location	location_md	sections	tags	birth_place	rebaptism_date
Lulu Geraldine Varney Richardson	female			25 Nov 1909	25 Nov 1909			9 Apr 1943	9 Apr 1943	9 Apr 1943	1943	Apr	9.0				excommunicated			Excommunicated.	[Excommunicated](https://archive.org/details/improvementera4610unse/page/n31).	Cambridge Branch, New England Mission	Cambridge Branch, New England Mission	Cambridge, Massachusetts	Cambridge, Massachusetts	['20th Century']	['improvement-era', '1943-oct']		
Richard Cleave Fitzpatrick	male			4 May 1906	4 May 1906			20 Apr 1943	20 Apr 1943	20 Apr 1943	1943	Apr	20.0			priest	excommunicated			Excommunicated.	[Excommunicated](https://archive.org/details/improvementera4610unse/page/n31).	Dublan Branch, Juarez Stake	Dublan Branch, Juarez Stake	Colonia Dubln, Chihuahua, Mexico	Colonia Dubln, Chihuahua, Mexico	['20th Century']	['improvement-era', '1943-oct']		
Erwin Campbell	male			5 Aug 1895	5 Aug 1895			30 May 1943	30 May 1943	30 May 1943	1943	May	30.0			priest	excommunicated			Excommunicated.	[Excommunicated](https://archive.org/details/improvementera4610unse/page/n31).	Twenty-fourth Ward, Salt Lake Stake	Twenty-fourth Ward, Salt Lake Stake	Salt Lake City, Utah	Salt Lake City, Utah	['20th Century']	['improvement-era', '1943-oct']		
Robert Garfield Terrell	male			15 Jan 1907	15 Jan 1907			21 Jun 1943	21 Jun 1943	21 Jun 1943	1943	Jun	21.0				excommunicated			Excommunicated.	[Excommunicated](https://archive.org/details/improvementera4610unse/page/n31).			Erie, Pennsylvania	Erie, Pennsylvania	['20th Century']	['improvement-era', '1943-oct']		
Lawrence Clyde Gowell	male			23 Sep 1909	23 Sep 1909			16 Jul 1943	16 Jul 1943	16 Jul 1943	1943	Jul	16.0			deacon	excommunicated			Excommunicated.	[Excommunicated](https://archive.org/details/improvementera4610unse/page/n31).	Cambridge Branch, New England Mission	Cambridge Branch, New England Mission	Cambridge, Massachusetts	Cambridge, Massachusetts	['20th Century']	['improvement-era', '1943-oct']		
Della Estella Gowell	female			3 Jun 1901	3 Jun 1901			16 Jul 1943	16 Jul 1943	16 Jul 1943	1943	Jul	16.0				excommunicated			Excommunicated.	[Excommunicated](https://archive.org/details/improvementera4610unse/page/n31).	Cambridge Branch, New England Mission	Cambridge Branch, New England Mission	Cambridge, Massachusetts	Cambridge, Massachusetts	['20th Century']	['improvement-era', '1943-oct']		
Ina May Gowell	female			14 Jun 1900	14 Jun 1900			16 Jul 1943	16 Jul 1943	16 Jul 1943	1943	Jul	16.0				excommunicated			Excommunicated.	[Excommunicated](https://archive.org/details/improvementera4610unse/page/n31).	Cambridge Branch, New England Mission	Cambridge Branch, New England Mission	Cambridge, Massachusetts	Cambridge, Massachusetts	['20th Century']	['improvement-era', '1943-oct']		
Karl Gottlieb Kirstein	male							9 Aug 1943	9 Aug 1943	9 Aug 1943	1943	Aug	9.0				excommunicated			Excommunicated.	[Excommunicated](https://archive.org/details/improvementera4611unse/page/n47).	Princesa Isabel District?, Brazilian Mission	Princesa Isabel District?, Brazilian Mission	Brazil?	Brazil?	['20th Century']	['improvement-era', '1943-nov']		
Ethel Walker Holly	female			1 Apr 1887	1 Apr 1887			10 Aug 1943	10 Aug 1943	10 Aug 1943	1943	Aug	10.0				excommunicated			Excommunicated.	[Excommunicated](https://archive.org/details/improvementera4611unse/page/n47).	Buffalo Branch, Eastern States Mission	Buffalo Branch, Eastern States Mission	Buffalo, New York	Buffalo, New York	['20th Century']	['improvement-era', '1943-nov']		
Carl James Brown	male							20 Aug 1943	20 Aug 1943	20 Aug 1943	1943	Aug	20.0				excommunicated			Excommunicated.	[Excommunicated](https://archive.org/details/improvementera4610unse/page/n31).	Cambridge Branch, New England Mission	Cambridge Branch, New England Mission	Cambridge, Massachusetts	Cambridge, Massachusetts	['20th Century']	['improvement-era', '1943-oct']		
Grant Holly	male			22 Oct 1886	22 Oct 1886			30 Aug 1943	30 Aug 1943	30 Aug 1943	1943	Aug	30.0			elder	excommunicated			Excommunicated.	[Excommunicated](https://archive.org/details/improvementera4611unse/page/n47).	Buffalo Branch, Eastern States Mission	Buffalo Branch, Eastern States Mission	Buffalo, New York	Buffalo, New York	['20th Century']	['improvement-era', '1943-nov']		
Archibald Hoffman	male			2 Jul 1892	2 Jul 1892			19 Sep 1943	19 Sep 1943	19 Sep 1943	1943	Sep	19.0			priest	excommunicated			Excommunicated.	[Excommunicated](https://archive.org/details/improvementera4611unse/page/n47).	Central Park Ward, South Salt Lake Stake	Central Park Ward, South Salt Lake Stake	South Salt Lake, Utah	South Salt Lake, Utah	['20th Century']	['improvement-era', '1943-nov']		
Richard R. Lyman	male	https://en.wikipedia.org/wiki/Richard_R._Lyman		1870	1870	1963	1963	12 Nov 1943	12 Nov 1943	12 Nov 1943	1943	Nov	12.0	Apostle	Apostle	apostle	excommunicated			Excommunicated for cohabitating with Anna Jacobsen Hegsted, a woman he considered his plural wife. He was rebaptized 27 Oct 1954 but not restored to the apostleship.	Excommunicated for cohabitating with Anna Jacobsen Hegsted, a woman he considered his plural wife. He was rebaptized 27 Oct 1954 but not restored to the apostleship.			Salt Lake City, Utah	Salt Lake City, Utah	['20th Century']			27 Oct 1954
Maurice Lerrie Glendenning	male			1891	1891	1969	1969	15 Jan 1945	15 Jan 1945	15 Jan 1945	1945	Jan	15.0	Founder of the Aaronic Order or House of Aaron sect	Founder of the Aaronic Order or [House of Aaron](https://en.wikipedia.org/wiki/House_of_Aaron) sect		excommunicated	instigating the 'Aaronic Order'		"Excommunicated for being the ""[i]nstigator of [the] 'Aaronic Order'"" because he founded a religious sect apart from the LDS church on the basis of revelations he claimed to receive from the ""Angel Elias"". He had grown up hearing ""heavenly music"", ""angelic poetry"", and ""doctrinal and philosophical statements"" within his own mind, and joined the LDS Church at least in part due to resonances between his revelations and the theology of the church. In 1942 he formally organized the Aaronic Order as a church, for which he was ultimately excommunicated in 1945. His major revelations were 1944's _Book of Elias, or the Record of John_ , 1948's _New Revelations for the Book of Elias, or the Record of John_ , and 1955's _Disciple Book_ , which were later collected as The Levitical Writings."	"[Excommunicated for being the ""[i]nstigator of [the] 'Aaronic Order'""](https://scholarsarchive.byu.edu/cgi/viewcontent.cgi?article=5669&context=etd) because he founded a religious sect apart from the LDS church on the basis of [revelations he claimed to receive from the ""Angel Elias""](https://www.dialoguejournal.com/wp-content/uploads/sbi/articles/Dialogue_V12N01_59.pdf). He had grown up hearing ""heavenly music"", ""angelic poetry"", and ""doctrinal and philosophical statements"" within his own mind, and joined the LDS Church at least in part due to resonances between his revelations and the theology of the church. In 1942 he formally organized the Aaronic Order as a church, for which he was ultimately excommunicated in 1945. His major revelations were 1944's _Book of Elias, or the Record of John_, 1948's _New Revelations for the Book of Elias, or the Record of John_, and 1955's _Disciple Book_, which were later collected as [The Levitical Writings](https://archive.org/details/TheLeviticalWritings)."	Eldredge Ward, South Salt Lake Stake	Eldredge Ward, South Salt Lake Stake	South Salt Lake, Utah	South Salt Lake, Utah	['20th Century']	['order-of-aaron-thesis']		
Walter Clare Card	male							16 Apr 1945	16 Apr 1945	16 Apr 1945	1945	Apr	16.0				excommunicated	affiliation with the 'Aaronic Order'		"Excommunicated for being ""[a]ffiliated with [the] 'Aaronic Order'""."	"[Excommunicated for being ""[a]ffiliated with [the] 'Aaronic Order'""](https://scholarsarchive.byu.edu/cgi/viewcontent.cgi?article=5669&context=etd)."	Eldredge Ward, South Salt Lake Stake	Eldredge Ward, South Salt Lake Stake	South Salt Lake, Utah	South Salt Lake, Utah	['20th Century']	['order-of-aaron-thesis']		
Viola Stone Card	female							8 Aug 1945	8 Aug 1945	8 Aug 1945	1945	Aug	8.0				excommunicated	affiliation with the 'Aaronic Order'		"Excommunicated for being ""[a]ffiliated with [the] 'Aaronic Order'""."	"[Excommunicated for being ""[a]ffiliated with [the] 'Aaronic Order'""](https://scholarsarchive.byu.edu/cgi/viewcontent.cgi?article=5669&context=etd)."	Eldredge Ward, South Salt Lake Stake	Eldredge Ward, South Salt Lake Stake	South Salt Lake, Utah	South Salt Lake, Utah	['20th Century']	['order-of-aaron-thesis']		
Murtle Maus Andrew	female							8 Aug 1945	8 Aug 1945	8 Aug 1945	1945	Aug	8.0				excommunicated	affiliation with the 'Aaronic Order'		"Excommunicated for being ""[a]ffiliated with [the] 'Aaronic Order'""."	"[Excommunicated for being ""[a]ffiliated with [the] 'Aaronic Order'""](https://scholarsarchive.byu.edu/cgi/viewcontent.cgi?article=5669&context=etd)."	Eldredge Ward, South Salt Lake Stake	Eldredge Ward, South Salt Lake Stake	South Salt Lake, Utah	South Salt Lake, Utah	['20th Century']	['order-of-aaron-thesis']		
Fawn M. Brodie	female	https://en.wikipedia.org/wiki/Fawn_M._Brodie		1915	1915	1981	1981	19 Jun 1946	19 Jun 1946	19 Jun 1946	1946	Jun	19.0	Psychobiographer, professor of history, David O. McKay niece	Psychobiographer, professor of history, David O. McKay niece		excommunicated			"Excommunicated for publishing _No Man Knows My History_, a biography of Joseph Smith in which she was said to have ""assert[ed] matters as truths which deny the divine origin of the Book of Mormon, the restoration of the Priesthood and of Christ's Church through the instrumentality of the Prophet Joseph Smith, contrary to the beliefs, doctrines and teachings of the Church."" She later stated that she was ""convinced before [she] ever began writing [ _No Man Knows My History_ ] that Joseph Smith was not a true Prophet."" Brodie's biography of Joseph Smith stands alongside Bushman's _Joseph Smith: Rough Stone Rolling_ as a preeminent account of Joseph Smith's life. She went on to write numerous biographies including the prescient _Thomas Jefferson: An Intimate History_ which was the first major work to argue that Thomas Jefferson had a sexual relationship with his slave, Sally Hemings."	"[Excommunicated for publishing _No Man Knows My History_](https://web.archive.org/web/20190207184806/http://www.salamandersociety.com/x-files/460523brodie_excom.pdf), a biography of Joseph Smith in which she was said to have ""assert\[ed\] matters as truths which deny the divine origin of the Book of Mormon, the restoration of the Priesthood and of Christ's Church through the instrumentality of the Prophet Joseph Smith, contrary to the beliefs, doctrines and teachings of the Church."" She [later stated](https://web.archive.org/web/20191110061253/https://www.dialoguejournal.com/wp-content/uploads/sbi/articles/Dialogue_V22N02_81.pdf) that she was ""convinced before \[she\] ever began writing \[_No Man Knows My History_\] that Joseph Smith was not a true Prophet."" Brodie's biography of Joseph Smith stands alongside Bushman's _Joseph Smith: Rough Stone Rolling_ as a preeminent account of Joseph Smith's life. She went on to write numerous biographies including the prescient _Thomas Jefferson: An Intimate History_ which was the first major work to argue that Thomas Jefferson had a sexual relationship with his slave, Sally Hemings."	New England Mission	New England Mission	Westville, Connecticut	Westville, Connecticut	['20th Century']			
John Horne Blackmore	male	https://en.wikipedia.org/wiki/John_Horne_Blackmore		1890	1890	1971	1971	1947	1947	1947	1947			Non-polygamous polygamy advocate, educator, Canadian legislator	Non-polygamous polygamy advocate, educator, Canadian legislator		excommunicated	teaching and advocating the doctrine of plural marriage		"Excommunicated for ""teaching and advocating the doctrine of plural marriage"". He used his position in the Canadian House of Commons to advocate for the legalization of polygamy, though he did not practice it himself."	"Excommunicated for ""teaching and advocating the doctrine of plural marriage"". He used his position in the Canadian House of Commons to advocate for the legalization of polygamy, though he did not practice it himself."			Canada	Canada	['20th Century']			
Sally Franchow	female							1952?	1952?	1952	1952			Defender of Annalee Skarin	Defender of Annalee Skarin		excommunicated			Excommunicated (according to Annalee Skarin) for defending Annalee in her own excommunication trial.	[Excommunicated (according to Annalee Skarin) for defending Annalee in her own excommunication trial](https://www.sunstonemagazine.com/pdf/081-42-46.pdf).			Utah	Utah	['20th Century']			
Annalee Skarin	female	https://en.wikipedia.org/wiki/Annalee_Skarin		1899	1899	1988	1988	11 Jun 1952	11 Jun 1952	11 Jun 1952	1952	Jun	11.0	Self-proclaimed prophetess, New Age icon	Self-proclaimed prophetess, New Age icon		excommunicated			"Excommunicated for refusing, at apostle Mark E. Peterson's insistence, to repudiate her book of revelations, _Ye Are Gods_. Elder Peterson's rationale for the top-down decision to excommunicate Annalee Skarin reportedly included the objection that she ""attempts to give revelations on her own part and defends this fact even though she is a woman."" Soon after her excommunication she claimed to have been translated and seemingly spent the rest of her life in hiding with her husband, Reason Skarin. Her daughter, Hope Hilton, wrote, ""Annalee was a paranoid-schizophrenic who listened to an inner voice whose tapes were often garbled. She was a dramatic actress who sought center stage and applause while proclaiming her humility. She was a master of cover-up which only those on the inside could see."""	"[Excommunicated for refusing, at apostle Mark E. Peterson's insistence, to repudiate her book of revelations, _Ye Are Gods_](https://www.sunstonemagazine.com/pdf/081-42-46.pdf). Elder Peterson's rationale for the top-down decision to excommunicate Annalee Skarin reportedly included the objection that she ""attempts to give revelations on her own part and defends this fact even though she is a woman."" Soon after her excommunication she claimed to have been translated and seemingly spent the rest of her life in hiding with her husband, Reason Skarin. Her daughter, Hope Hilton, [wrote](https://www.sunstonemagazine.com/wp-content/uploads/sbi/articles/081-47-48.pdf), ""Annalee was a paranoid-schizophrenic who listened to an inner voice whose tapes were often garbled. She was a dramatic actress who sought center stage and applause while proclaiming her humility. She was a master of cover-up which only those on the inside could see."""			Utah	Utah	['20th Century']			
Sandra Tanner	female	https://en.wikipedia.org/wiki/Jerald_and_Sandra_Tanner		14 Jan 1941	14 Jan 1941			7 Jul 1960	7 Jul 1960	7 Jul 1960	1960	Jul	7.0	_Utah Lighthouse Ministry_ co-founder, publisher on Mormonism	_Utah Lighthouse Ministry_ co-founder, publisher on Mormonism		excommunicated-at-own-request			"Excommunicated at her own request for ""[a]postacy, and engaging in activities contrary to the best interests of the church"". She and her husband, Jerald Tanner, left the church shortly after their wedding objecting to the church's treatment of its black members as well as historical research that painted a picture of early church leaders which they could not reconcile with belief. They went on to found the _Utah Lighthouse Ministry_ and publish widely on church topics, missionizing Mormons into mainstream Christianity."	"[Excommunicated at her own request for ""\[a\]postacy, and engaging in activities contrary to the best interests of the church""](https://web.archive.org/web/20191113065419/https://collections.lib.utah.edu/file?id=788232&nocache=true). She and her husband, Jerald Tanner, left the church shortly after their wedding objecting to the church's treatment of its black members as well as historical research that painted a picture of early church leaders which they could not reconcile with belief. They went on to found the _Utah Lighthouse Ministry_ and publish widely on church topics, missionizing Mormons into mainstream Christianity."	North Hollywood Ward, Burbank Stake	North Hollywood Ward, Burbank Stake	North Hollywood, Los Angeles, California	North Hollywood, Los Angeles, California	['20th Century']			
Jerald Tanner	male	https://en.wikipedia.org/wiki/Jerald_and_Sandra_Tanner		1 Jun 1938	1 Jun 1938	1 Oct 2006	1 Oct 2006	14 Aug 1960	14 Aug 1960	14 Aug 1960	1960	Aug	14.0	_Utah Lighthouse Ministry_ co-founder, publisher on Mormonism	_Utah Lighthouse Ministry_ co-founder, publisher on Mormonism		excommunicated-at-own-request			"Excommunicated at his own request for a ""voluntary request for [his] name to be stricken from the records [of the church] and teaching doctrines which are not in harmony with the Church of Jesus Christ of Latter-Day Saints"". He and his wife, Sandra Tanner, left the church shortly after their wedding objecting to the church's treatment of its black members as well as historical research that painted a picture of early church leaders which they could not reconcile with belief. They went on to found the _Utah Lighthouse Ministry_ and publish widely on church topics, missionizing Mormons into mainstream Christianity."	"[Excommunicated at his own request for a ""voluntary request for \[his\] name to be stricken from the records \[of the church\] and teaching doctrines which are not in harmony with the Church of Jesus Christ of Latter-Day Saints""](https://web.archive.org/web/20191113065419/https://collections.lib.utah.edu/file?id=788232&nocache=true). He and his wife, Sandra Tanner, left the church shortly after their wedding objecting to the church's treatment of its black members as well as historical research that painted a picture of early church leaders which they could not reconcile with belief. They went on to found the _Utah Lighthouse Ministry_ and publish widely on church topics, missionizing Mormons into mainstream Christianity."	Cannon Seventh Ward, Cannon Stake	Cannon Seventh Ward, Cannon Stake	Salt Lake City, Utah	Salt Lake City, Utah	['20th Century']			
John Singer	male	https://en.wikipedia.org/wiki/John_Singer_(anti-government_activist)		1931	1931	1979	1979	1972?	1972?	1972	1972			Polygamist, anti-government activist	Polygamist, anti-government activist		excommunicated			Excommunicated for refusal to sustain Joseph Fielding Smith as a prophet. He entered a polygamous relationship and went on to defy the government in a fight over homeschooling his children. He was shot in a confrontation with police when he refused to surrender his second (polygamous) wife's children (in legal custody of her now-ex-husband) to the state.	[Excommunicated for refusal to sustain Joseph Fielding Smith as a prophet](https://reason.com/1979/07/01/man-vs-state/). He entered a polygamous relationship and went on to defy the government in a fight over homeschooling his children. He was [shot in a confrontation with police](https://books.google.com/books?id=Fk6xCgAAQBAJ&pg=PA91&lpg=PA91&dq=john+singer+excommunication&source=bl&ots=w6kGWSHKwS&sig=ACfU3U2M0KyPzHiG3Ng2gm02U8QNbeLtsQ&hl=en&sa=X&ved=2ahUKEwiX1-Cj77PlAhU_FTQIHW7qDTcQ6AEwEHoECAkQAQ#v=onepage&q=john%20singer%20excommunication&f=false) when he [refused to surrender his second (polygamous) wife's children](https://www.uen.org/utah_history_encyclopedia/s/SINGER_JOHN.shtml) (in legal custody of her now-ex-husband) to the state.			Utah	Utah	['20th Century']			
Ogden Kraut	male	https://en.wikipedia.org/wiki/Ogden_Kraut		21 Jun 1927	21 Jun 1927	17 Jul 2002	17 Jul 2002	1972	1972	1972	1972			Independent Mormon fundamentalist author	Independent Mormon fundamentalist author		excommunicated	advocating polygamy		Excommunicated for advocating polygamy. A friend of fellow excommunicants John and Vickie Singer, he later acted as mediator in the Singer-Swapp standoff.	Excommunicated for advocating polygamy. A friend of fellow excommunicants John and Vickie Singer, he later [acted as mediator in the Singer-Swapp standoff](https://www.sunstonemagazine.com/pdf/068-10-17.pdf).					['20th Century']			
Richard McCoy, Jr.	male	https://en.wikipedia.org/wiki/Richard_McCoy_Jr.		1942	1942	1974	1974	6 Jun 1972	6 Jun 1972	6 Jun 1972	1972	Jun	6.0	Sunday School teacher, copycat skyjacker	Sunday School teacher, copycat skyjacker		excommunicated	['skyjacking', 'extortion']		"Excommunicated ""on the grounds of skyjacking and extortion"". Richard McCoy, Jr., hijacked a United Airlines passenger jet for ransom in 1972, four months after the more infamous D.B. Cooper carried out a similar and still-unsolved hijacking. Due to the similarity, McCoy has been considered a suspect in the D.B. Cooper crime. He was excommunicated in response to his crimes, and was shot after escaping from prison."	"[Excommunicated ""on the grounds of skyjacking and extortion""](https://web.archive.org/web/20190406214136/http://www.ldsfilm.com/movies/DBCooper.html). Richard McCoy, Jr., hijacked a United Airlines passenger jet for ransom in 1972, four months after the more infamous D.B. Cooper carried out a similar and still-unsolved hijacking. Due to the similarity, McCoy has been considered a suspect in the D.B. Cooper crime. He was excommunicated in response to his crimes, and was shot after escaping from prison."	Provo Stake	Provo Stake	Provo, Utah	Provo, Utah	['20th Century']			
Vickie Singer	female							1970 or 1972	1970 or 1972	1970	1970			Polygamist, anti-government activist	Polygamist, anti-government activist		excommunicated			Excommunicated for refusal to sustain Joseph Fielding Smith as a prophet. Nearly a decade after her husband's death, she participated in the bombing of an LDS chapel, for which she spent five years in prison after a violent standoff.	[Excommunicated for refusal to sustain Joseph Fielding Smith as a prophet](https://reason.com/1979/07/01/man-vs-state/). Nearly a decade after her husband's death, she participated in [the bombing of an LDS chapel](https://en.wikipedia.org/wiki/Singer-Swapp_Standoff), for which she spent five years in prison after a violent standoff.			Utah	Utah	['20th Century']			
Ted Bundy	male	https://en.wikipedia.org/wiki/Ted_Bundy		1946	1946	1989	1989	1976?	1976?	1976	1976			Convicted serial killer and rapist	Convicted serial killer and rapist		excommunicated			Excommunicated following his conviction for kidnapping. His participation in Mormonism was brief: he was baptized in August or September 1975, jailed that year, convicted in 1976, and excommunicated in response. He had already been murdering people when he joined the church. He made two dramatic escapes and three further murders before being recaptured and thrice sentenced to death. He was executed for his crimes in 1989. Temple work was performed for him posthumously.	[Excommunicated following his conviction for kidnapping](https://news.google.com/newspapers?id=xbMwAAAAIBAJ&sjid=-PoDAAAAIBAJ&dq=ted%20bundy%20mormon&pg=6890%2C1373449). His participation in Mormonism was brief: he was baptized in August or September 1975, jailed that year, convicted in 1976, and excommunicated in response. He had already been murdering people when he joined the church. He made two dramatic escapes and three further murders before being recaptured and thrice sentenced to death. He was executed for his crimes in 1989. Temple work was performed for him posthumously.			Utah	Utah	['20th Century']			
Byron Merchant	male							14 Oct 1977	14 Oct 1977	14 Oct 1977	1977	Oct	14.0	Race ban protester	Race ban protester		excommunicated			"Excommunicated for opposition to the race-based priesthood and temple ban. His ""opposed"" vote in General Conference led to the instigation of disciplinary action against him."	"[Excommunicated for opposition to the race-based priesthood and temple ban](https://ordainwomen.org/byrons-song/). His ""opposed"" vote in General Conference led to the instigation of disciplinary action against him."					['20th Century']			
Arthur Gary Bishop	male	https://en.wikipedia.org/wiki/Arthur_Gary_Bishop		1952	1952	1988	1988	Oct 1978	Oct 1978	Oct 1978	1978	Oct		Embezzler, serial killer, child molester	Embezzler, serial killer, child molester		excommunicated			Excommunicated after being convicted of embezzlement. He went on to become a serial killer and child molester.	Excommunicated after being convicted of embezzlement. He went on to become a serial killer and child molester.			Utah	Utah	['20th Century']			
Sonia Johnson	female	https://en.wikipedia.org/wiki/Sonia_Johnson		1936	1936			5 Dec 1979	5 Dec 1979	5 Dec 1979	1979	Dec	5.0	Feminist	Feminist		excommunicated			Excommunicated for her work in promoting the Equal Rights Amendment.	Excommunicated for her work in promoting the Equal Rights Amendment.	Sterling Park, Virginia Ward	[Sterling Park, Virginia Ward](https://web.archive.org/web/20190721165118/https://www.churchofjesuschrist.org/study/ensign/1980/03/news-of-the-church/church-court-action-clarified?lang=eng)	Sterling Park, Virginia	[Sterling Park, Virginia](https://web.archive.org/web/20190721165118/https://www.churchofjesuschrist.org/study/ensign/1980/03/news-of-the-church/church-court-action-clarified?lang=eng)	['20th Century']			
