name	sex	wikipedia_url	jsp_url	birth_date	birth_date_md	death_date	death_date_md	date	date_md	best_date	best_year	best_month	best_day	tagline	tagline_md	office	outcome	for	alt_for	notes	notes_md	unit	unit_md	location	location_md	sections	tags	birth_place	rebaptism_date
William E. McLellin	male	https://en.wikipedia.org/wiki/William_E._McLellin	https://www.josephsmithpapers.org/person/william-earl-mclellin	18 Jan 1806	18 Jan 1806	24 Apr 1883	24 Apr 1883	3 Dec 1832	3 Dec 1832	3 Dec 1832	1832	Dec	3.0	Original member of the Quorum of the Twelve Apostles	Original member of the Quorum of the Twelve Apostles		excommunicated			Excommunicated.	[Excommunicated](https://www.josephsmithpapers.org/paper-summary/journal-1832-1834/4).			Kirtland, Ohio	Kirtland, Ohio	['19th Century']			
Jesse Gause	male	https://en.wikipedia.org/wiki/Jesse_Gause	https://www.josephsmithpapers.org/person/jesse-gause	1785	1785	1836?	1836?	prob. 3 Dec 1832	prob. 3 Dec 1832	3 Dec 1832	1832	Dec	3.0	First Presidency member and missionary	First Presidency member and missionary		excommunicated			Apparently excommunicated, for reasons unknown. A former Quaker and Shaker, his conversion to Mormonism introduced strain on his marriage that may have been a factor in his estrangement from the church.	[Apparently excommunicated](https://www.josephsmithpapers.org/person/jesse-gause), for reasons unknown. A former Quaker and Shaker, his conversion to Mormonism introduced strain on his marriage that may have been a factor in his estrangement from the church.			Kirtland, Ohio	Kirtland, Ohio	['19th Century']			
Burr Riggs	male		https://www.josephsmithpapers.org/person/burr-riggs	1811	1811	1860	1860	26 Feb 1833	26 Feb 1833	26 Feb 1833	1833	Feb	26.0	Zelph Co-discoverer	Zelph Co-discoverer		excommunicated	['neglecting to make satisfaction to the church as he had agreed', 'disgracing the high priesthood by neglect of ', 'saying he did not care how soon he was cut off from the church']		"Excommunicated by a conference of high priests in Kirtland, for ""neglecting to make satisfaction to the church as he had agreed, and disgracing the high priesthood by neglect of duty and saying he did not care how soon he was cut off from the church. &c. &c"" On February 13th, a ""council of High priests assembled to investigate the proceedings of Bro Burr Riggs, who was accused of not magnifying his calling as a high priest, but had been guilty of neglect of duty, of abusing the elders, and of treating their admonitions with contempt. After the council had considered the case, Brother Riggs agreed to make satisfaction, but did not shew much humility."" After his excommunication he was later reinstated in the church, and also later excommunicated, and reinstated yet again."	"[Excommunicated by a conference of high priests in Kirtland, for ""neglecting to make satisfaction to the church as he had agreed, and disgracing the high priesthood by neglect of duty and saying he did not care how soon he was cut off from the church. &c. &c""](https://www.josephsmithpapers.org/paper-summary/history-1838-1856-volume-a-1-23-december-1805-30-august-1834/281) On [February 13th](https://www.josephsmithpapers.org/paper-summary/history-1838-1856-volume-a-1-23-december-1805-30-august-1834/280), a ""council of High priests assembled to investigate the proceedings of Bro Burr Riggs, who was accused of not magnifying his calling as a high priest, but had been guilty of neglect of duty, of abusing the elders, and of treating their admonitions with contempt. After the council had considered the case, Brother Riggs agreed to make satisfaction, but did not shew much humility."" After his excommunication he was [later reinstated](https://www.josephsmithpapers.org/person/burr-riggs) in the church, and also later excommunicated, and reinstated yet again."			Kirtland, Ohio	Kirtland, Ohio	['19th Century']			
Doctor Philastus Hurlbut	male	https://en.wikipedia.org/wiki/Doctor_Philastus_Hurlbut		1809	1809	1883	1883	3 Jun 1833	3 Jun 1833	3 Jun 1833	1833	Jun	3.0	Amorous Apostate, Early Church Foe	Amorous Apostate, Early Church Foe		excommunicated	unchristian conduct with the female sex while on a mission to the east		"Excommunicated in absentia for ""unchristian conduct with the female sex while on a mission to the east"". He was found sufficiently penitent upon appeal that his membership was restored 21 Jun 1833 only to be revoked again two days later because he had reportedly claimed to have ""deceived"" the prior council. He went on to become a notorious critic of Mormonism, being a major contributor to Eber D. Howe's _Mormonism Unvailed_ , for which he collected affidavits against the character of Joseph Smith and his family."	"[Excommunicated in absentia for ""unchristian conduct with the female sex while on a mission to the east""](https://www.josephsmithpapers.org/paper-summary/minute-book-1/16). He was found sufficiently penitent upon appeal that [his membership was restored 21 Jun 1833](https://www.josephsmithpapers.org/paper-summary/minute-book-1/25) only to be [revoked again two days later](https://www.josephsmithpapers.org/paper-summary/minute-book-1/26) because he had reportedly claimed to have ""deceived"" the prior council. He went on to become a notorious critic of Mormonism, being a major contributor to Eber D. Howe's _Mormonism Unvailed_, for which he collected affidavits against the character of Joseph Smith and his family."			Kirtland, Ohio	Kirtland, Ohio	['19th Century']			
Daniel Copley	male			abt. 1811	abt. 1811	1862	1862	21 Jun 1833	21 Jun 1833	21 Jun 1833	1833	Jun	21.0	Reluctant missionary	Reluctant missionary		excommunicated	because he refused to fulfill his mission according to the Council of the High Priesthood of the holy order of God		"Excommunicated ""because he refused to fulfill his mission according to the Council of the High Priesthood of the holy order of God"". Much like his likewise-excommunicated father, Leman Copley, Daniel Copley struggled to be ""all in"" on the church. When assigned to serve a mission with (later excommunicated) Doctor Philastus Hurlbut, he refused. He later went on to serve in the First Regiment of Wisconsin Volunteers in the American Civil War."	"[Excommunicated ""because he refused to fulfill his mission according to the Council of the High Priesthood of the holy order of God""](https://www.josephsmithpapers.org/paper-summary/minutes-21-june-1833/1). Much like his likewise-excommunicated father, Leman Copley, Daniel Copley struggled to be ""all in"" on the church. When assigned to serve a mission with (later excommunicated) Doctor Philastus Hurlbut, [he refused](https://www.josephsmithpapers.org/person/daniel-copley). He later went on to serve in the First Regiment of Wisconsin Volunteers in the American Civil War."			Kirtland, Ohio	Kirtland, Ohio	['19th Century']			
William E. McLellin	male	https://en.wikipedia.org/wiki/William_E._McLellin	https://www.josephsmithpapers.org/person/william-earl-mclellin	1806	1806	1883	1883	4 Aug 1835	4 Aug 1835	4 Aug 1835	1835	Aug	4.0	Original member of the Quorum of the Twelve Apostles	Original member of the Quorum of the Twelve Apostles		disfellowshipped			"Disfellowshipped for failing to solicit donations for ""a house in which to receive an endowment"", and for a ""libel"" against the church due to this seemingly innocuous quotation from a letter he wrote his wife: ""You say, that it will not be in your power to go to school this summer---I am glad that it is not, since Eld[e]r [Orson] Hyde has returned and given, me a description of the manner in which it is conducted. though we do not wish to cast any reflections."""	"[Disfellowshipped](https://www.josephsmithpapers.org/paper-summary/letter-to-quorum-of-the-twelve-4-august-1835/2) for failing to solicit donations for ""a house in which to receive an endowment"", and for a ""libel"" against the church due to this seemingly innocuous quotation from a letter he wrote his wife: ""You say, that it will not be in your power to go to school this summer---I am glad that it is not, since Eld\[e\]r \[Orson\] Hyde has returned and given, me a description of the manner in which it is conducted. though we do not wish to cast any reflections."""					['19th Century']			
James Patten	male							7 Aug 1835	7 Aug 1835	7 Aug 1835	1835	Aug	7.0				excommunicated	['improper conduct', 'refusing to give up his license']		"Excommunicated for ""improper conduct, and refusing to give up his license""."	"[Excommunicated for ""improper conduct, and refusing to give up his license""](https://byustudies.byu.edu/content/volume-2-chapter-17)."			Bradford, Massachusetts	Bradford, Massachusetts	['19th Century']			
Harvey G. Whitlock	male	https://en.wikipedia.org/wiki/Harvey_G._Whitlock	https://www.josephsmithpapers.org/person/harvey-gilman-whitlock	1809	1809	after 1880	after 1880	by 28 Sep 1835	by 28 Sep 1835	28 Sep 1835	1835	Sep	28.0	Early Mormon physician, Book of Commandments witness	Early Mormon physician, Book of Commandments witness		excommunicated			Excommunicated, perhaps for adultery. He was rebaptized around 30 Jan 1836.	[Excommunicated](https://www.josephsmithpapers.org/paper-summary/journal-1835-1836/43), perhaps [for adultery](https://catalog.churchofjesuschrist.org/assets?id=6356ac4d-c36f-483c-b90e-37ce4fa02547&crate=0&index=266). He was [rebaptized](https://www.josephsmithpapers.org/paper-summary/minute-book-1/141) around 30 Jan 1836.					['19th Century']			
John F. Boynton	male	https://en.wikipedia.org/wiki/John_F._Boynton	https://www.josephsmithpapers.org/person/john-farnham-boynton	1811	1811	1890	1890	1837	1837	1837	1837			Apostle, Geologist, Inventor	Apostle, Geologist, Inventor		excommunicated			Excommunicated.	[Excommunicated](https://www.josephsmithpapers.org/person/john-farnham-boynton).			Kirtland, Ohio	Kirtland, Ohio	['19th Century']			
Solomon Wilbur Denton	male	https://en.wikipedia.org/wiki/Solomon_Wilbur_Denton		1816	1816	1864	1864	Apr? 1837	Apr? 1837	Apr 1837	1837	Apr		Printer, bodyguard	Printer, bodyguard		excommunicated	['lack of faith', 'non-observance of duties', 'contempt for the quorum of High Priests']		"Excommunicated ""for lack of faith, non-observance of duties and contempt for the quorum of High Priests"". He had testified in court that Joseph Smith had recruited him to murder Grandison Newell (a murder which never occurred)."	"[Excommunicated ""for lack of faith, non-observance of duties and contempt for the quorum of High Priests""](https://archive.org/details/PainesvilleTelegraph9June1837/page/n1). He had testified in court that Joseph Smith had recruited him to murder Grandison Newell (a murder which never occurred)."					['19th Century']			
John F. Boynton	male	https://en.wikipedia.org/wiki/John_F._Boynton		1811	1811	1890	1890	3 Sep 1837	3 Sep 1837	3 Sep 1837	1837	Sep	3.0	Original member of the Quorum of the Twelve Apostles, geologist, inventor	Original member of the Quorum of the Twelve Apostles, geologist, inventor		disfellowshipped			"Disfellowshipped by conference vote. He was a founding member of the Quorum of the Twelve Apostles who grew dissatisfied after the failure of the Kirtland Safety Society. Reinstated a week later. Repeatedly disfellowshipped (along with numerous others) for ""dancing with the world"" and attending balls."	"[Disfellowshipped by conference vote](https://www.josephsmithpapers.org/paper-summary/minute-book-1/239). He was a founding member of the Quorum of the Twelve Apostles who grew dissatisfied after the failure of the Kirtland Safety Society. [Reinstated a week later](https://www.josephsmithpapers.org/paper-summary/minute-book-1/244). [Repeatedly disfellowshipped](https://www.josephsmithpapers.org/paper-summary/minute-book-1/255) (along with numerous others)<!--TODO--> for ""dancing with the world"" and [attending balls](https://www.josephsmithpapers.org/paper-summary/minute-book-1/260)."			Kirtland, Ohio	Kirtland, Ohio	['19th Century']			
Luke Johnson	male	https://en.wikipedia.org/wiki/Luke_Johnson_(Mormon)		1807	1807	1861	1861	3 Sep 1837	3 Sep 1837	3 Sep 1837	1837	Sep	3.0	Original member of the Quorum of the Twelve Apostles	Original member of the Quorum of the Twelve Apostles		disfellowshipped			Disfellowshipped for reasons not given but likely in connection with the failure of the Kirtland Safety Society. Reinstated a week later.	[Disfellowshipped](https://www.josephsmithpapers.org/paper-summary/minute-book-1/239) for reasons not given but likely in connection with the failure of the Kirtland Safety Society. Reinstated [a week later](https://www.josephsmithpapers.org/paper-summary/minute-book-1/244).			Kirtland, Ohio	Kirtland, Ohio	['19th Century']			
Lyman E. Johnson	male	https://en.wikipedia.org/wiki/Lyman_E._Johnson		1811	1811	1859	1859	3 Sep 1837	3 Sep 1837	3 Sep 1837	1837	Sep	3.0				disfellowshipped			Disfellowshipped for reasons not given but likely in connection with the failure of the Kirtland Safety Society. Reinstated a week later.	[Disfellowshipped](https://www.josephsmithpapers.org/paper-summary/minute-book-1/239) for reasons not given but likely in connection with the failure of the Kirtland Safety Society. Reinstated [a week later](https://www.josephsmithpapers.org/paper-summary/minute-book-1/244).			Kirtland, Ohio	Kirtland, Ohio	['19th Century']			
Roger Orton	male	https://en.wikipedia.org/wiki/Roger_Orton		1799	1799	1851	1851	30 Nov 1837	30 Nov 1837	30 Nov 1837	1837	Nov	30.0	Deadbeat president of the Seventy	Deadbeat president of the Seventy		excommunicated	['abusing Elder Brigham Young', 'a general course of unchristian like conduct', 'showing contempt to the authorities of the church']		"Excommunicated ""for abusing Elder Brigham Young"" and a ""general course of unchristian like conduct"", and also for ""showing contempt to the authorities of the church"". He was later reinstated and appointed to the presidency of the Seventy around 1844 but did not accept the calling. He did not go to Utah but died in Iowa."	"[Excommunicated ""for abusing Elder Brigham Young""](https://www.josephsmithpapers.org/paper-summary/minute-book-1/268) and a [""general course of unchristian like conduct"", and also for ""showing contempt to the authorities of the church""](https://www.josephsmithpapers.org/paper-summary/minute-book-1/269). He was later reinstated and [appointed to the presidency of the Seventy around 1844](https://www.josephsmithpapers.org/person/roger-orton) but did not accept the calling. He did not go to Utah but died in Iowa."			Kirtland, Ohio	Kirtland, Ohio	['19th Century']			
Warren Parrish	male	https://en.wikipedia.org/wiki/Warren_Parrish	https://www.josephsmithpapers.org/person/warren-farr-parrish	1803	1803	1877	1877	Dec 1837	Dec 1837	Dec 1837	1837	Dec		Seventy, accused embezzler, dissident	Seventy, accused embezzler, dissident		excommunicated			Excommunicated while leading a group of dissidents opposed to Joseph Smith. He had been accused of embezzling from the Kirtland Safety Society and thus participating in its downfall.	[Excommunicated while leading a group of dissidents opposed to Joseph Smith](https://www.josephsmithpapers.org/person/warren-farr-parrish). He had been accused of embezzling from the Kirtland Safety Society and thus participating in its downfall.					['19th Century']			
Leonard Rich	male	https://en.wikipedia.org/wiki/Leonard_Rich	https://www.josephsmithpapers.org/person/leonard-rich?highlight=Leonard%20Rich	1800	1800	1868	1868	Dec 1837	Dec 1837	Dec 1837	1837	Dec		Inaugural member of the Seven Presidents of Seventy	Inaugural member of the Seven Presidents of Seventy		excommunicated			"Excommunicated after joining a group of dissenters led by fellow excommunicant Warren Parrish, attempting to restore the church to its prior form as the ""Church of Christ""."	"Excommunicated after joining a group of dissenters led by fellow excommunicant Warren Parrish, attempting to restore the church to its prior form as the ""Church of Christ""."					['19th Century']			
Luke Johnson	male	https://en.wikipedia.org/wiki/Luke_Johnson_(Mormon)	https://www.josephsmithpapers.org/person/luke-johnson	1807	1807	1861	1861	1838	1838	1838	1838			Original member of the Quorum of the Twelve Apostles	Original member of the Quorum of the Twelve Apostles		excommunicated			Excommunicated. He was rebaptized in 1846 and journeyed to Utah where he lived the rest of his life.	[Excommunicated](https://www.josephsmithpapers.org/person/luke-johnson). He was rebaptized in 1846 and journeyed to Utah where he lived the rest of his life.					['19th Century']			
Harvey G. Whitlock	male	https://en.wikipedia.org/wiki/Harvey_G._Whitlock	https://www.josephsmithpapers.org/person/harvey-gilman-whitlock	1809	1809	after 1880	after 1880	1838?	1838?	1838	1838			Early Mormon physician, Book of Commandments witness	Early Mormon physician, Book of Commandments witness		excommunicated			"Presumably excommunicated after he ""withdrew"" from the church as he was rebaptized in 1858. The ""Journal History of the Church"" in 1859 reported that he had ""apostatized"" in 1838 and ""went with Geo[rge] M. Hinkle"", the later- excommunicated militia leader who turned Joseph Smith over to the Missourians."	"[Presumably excommunicated](https://www.josephsmithpapers.org/person/harvey-gilman-whitlock) after he ""withdrew"" from the church as he was rebaptized in 1858. The ""Journal History of the Church"" in 1859 [reported](https://catalog.churchofjesuschrist.org/assets?id=6356ac4d-c36f-483c-b90e-37ce4fa02547&crate=0&index=266) that he had ""apostatized"" in 1838 and ""went with Geo\[rge\] M. Hinkle"", the later-excommunicated militia leader who turned Joseph Smith over to the Missourians."					['19th Century']			
John Gaylord	male	https://en.wikipedia.org/wiki/John_Gaylord		1797	1797	1874	1874	13 Jan 1838	13 Jan 1838	13 Jan 1838	1838	Jan	13.0	Member of the Presidency of the Seventy	Member of the Presidency of the Seventy		excommunicated	rising up in rebellion against the church		"Excommunicated for ""rising up in rebellion against the church"", reportedly due to his bitterness over the failure of the Kirtland Safety Society. He later reunited with the church, following James J. Strang after Joseph Smith's death, and joining the Reorganized Church of Jesus Christ of Latter Day Saints upon Strang's death."	"[Excommunicated for ""rising up in rebellion against the church""](https://www.josephsmithpapers.org/back/general-church-officers-october-1835-january-1838), reportedly due to his bitterness over the failure of the Kirtland Safety Society. He later reunited with the church, following James J. Strang after Joseph Smith's death, and joining the Reorganized Church of Jesus Christ of Latter Day Saints upon Strang's death."					['19th Century']			
John Whitmer	male	https://en.wikipedia.org/wiki/John_Whitmer	https://www.josephsmithpapers.org/person/john-whitmer	27 Aug 1802	27 Aug 1802	11 Jul 1878	11 Jul 1878	10 Mar 1838	10 Mar 1838	10 Mar 1838	1838	Mar	10.0	One of the Eight Witnesses of the Book of Mormon	One of the Eight Witnesses of the Book of Mormon		excommunicated	persisting in unchristian like conduct		"Excommunicated alongside W. W. Phelps for ""persisting in unchristian like conduct"". The minutes of the Far West High Council recorded: ""After some remarks by Presidents Marsh & Patten, setting forth the iniquity of those men, in claiming the $2.000 spoken of, which did not belong to them any more than any other person in the church; it was decided that William W. Phelps and John Whitmer be no longer members of the church of Christ of Latter Day Saints, & be given over to the buffetings of Satan, until they learn to blaspheme no more against the authorities of God, nor fleece the flock of Christ."" He was driven from Far West along with other ""dissenters"". After Joseph Smith's death he supported his brother's (David Whitmer's) claim to church leadership."	"[Excommunicated alongside W. W. Phelps for ""persisting in unchristian like conduct""](https://www.josephsmithpapers.org/paper-summary/minute-book-2/110). The minutes of the Far West High Council recorded: ""After some remarks by Presidents Marsh & Patten, setting forth the iniquity of those men, in claiming the $2.000 spoken of, which did not belong to them any more than any other person in the church; it was decided that William W. Phelps and John Whitmer be no longer members of the church of Christ of Latter Day Saints, & be given over to the buffetings of Satan, until they learn to blaspheme no more against the authorities of God, nor fleece the flock of Christ."" He was driven from Far West along with other ""dissenters"". After Joseph Smith's death he supported his brother's (David Whitmer's) claim to church leadership."			Far West, Missouri	Far West, Missouri	['19th Century']			
W. W. Phelps	male	https://en.wikipedia.org/wiki/W._W._Phelps_(Mormon)	https://www.josephsmithpapers.org/person/william-wines-phelps	1792	1792	1872	1872	10 Mar 1838	10 Mar 1838	10 Mar 1838	1838	Mar	10.0	Printer and hymnist	Printer and hymnist		excommunicated	persisting in unchristian like conduct		"Excommunicated alongside John Whitmer for ""persisting in unchristian like conduct"", specifically for alleged mishandling of Far West land, and temple donations."	"[Excommunicated alongside John Whitmer for ""persisting in unchristian like conduct""](https://www.josephsmithpapers.org/paper-summary/minute-book-2/110), specifically for alleged mishandling of Far West land, and temple donations."			Far West, Missouri	Far West, Missouri	['19th Century']			
Oliver Cowdery	male	https://en.wikipedia.org/wiki/Oliver_Cowdery		1806	1806	1850	1850	12 Apr 1838	12 Apr 1838	12 Apr 1838	1838	Apr	12.0	Book of Mormon Witness, Apostle, Second Elder, Assistant President	Book of Mormon Witness, Apostle, Second Elder, Assistant President		excommunicated	numerous charges		"Excommunicated on six different charges, including his accusation that Joseph Smith was an adulterer due to his relationship with Fanny Alger which Cowdery termed a ""dirty, nasty, filthy affair"". He was rebaptized into the LDS church in 1848."	"[Excommunicated](https://www.josephsmithpapers.org/paper-summary/journal-march-september-1838/17) [on six different charges, including his accusation that Joseph Smith was an adulterer](https://www.josephsmithpapers.org/paper-summary/journal-march-september-1838/16) due to his relationship with Fanny Alger which Cowdery termed a ""dirty, nasty, filthy affair"". He was rebaptized into the LDS church in 1848."			Far West, Missouri	Far West, Missouri	['19th Century']			
Lyman E. Johnson	male	https://en.wikipedia.org/wiki/Lyman_E._Johnson		1811	1811	1859	1859	13 Apr 1838	13 Apr 1838	13 Apr 1838	1838	Apr	13.0				excommunicated	numerous charges		"Excommunicated in Far West on seven different charges, including ""virtually denying the faith of the Church of Christ of Latter Day saints, by vindicating the cause of the enemies of this Church, who are dissenters from us"", ""seeking to injure the character of Joseph Smith jr"", and ""taking whiskey and making Weldon drink & then cheating him out of his property"". The minutes record that ""After some few appropriate remarks, by the Councellors, it was decided by the President that Lyman E. Johnson be no longer considered a member of the Church of Christ of Latter Day Saints, nor a member of the Quorum of the twelve Apostles of the Lamb and also be given over to the buffetings of Satan untill he learns to blaspheme no more against the authorities of God."""	"[Excommunicated](https://www.josephsmithpapers.org/paper-summary/minute-book-2/134) in Far West on [seven different charges](https://www.josephsmithpapers.org/paper-summary/minute-book-2/130), including ""virtually denying the faith of the Church of Christ of Latter Day saints, by vindicating the cause of the enemies of this Church, who are dissenters from us"", ""seeking to injure the character of Joseph Smith jr"", and ""taking whiskey and making Weldon drink & then cheating him out of his property"". The minutes record that ""After some few appropriate remarks, by the Councellors, it was decided by the President that Lyman E. Johnson be no longer considered a member of the Church of Christ of Latter Day Saints, nor a member of the Quorum of the twelve Apostles of the Lamb and also be given over to the buffetings of Satan untill he learns to blaspheme no more against the authorities of God."""			Far West, Missouri	Far West, Missouri	['19th Century']			
